{
  "version": "openudon.browser-capture-start.v1",
  "mode": "registration",
  "absolute_seconds": 600,
  "operator_idle_seconds": 180,
  "registration": {
    "profile_id": "dedicated-test-user",
    "url": "https://members.example.test/register",
    "origins": [
      "https://members.example.test"
    ],
    "transaction_id": "dedicated-test-registration"
  }
}
